{
  "meta": {
    "company_name": "Cyabra, Inc.",
    "ticker": "CYAB",
    "exchange": "Nasdaq Global Market",
    "currency": "USD",
    "valuation_date": "2026-07-31",
    "last_updated": "2026-08-01T17:30:00+09:00",
    "source_cutoff": "2026-07-31T23:59:59-04:00",
    "framework_version": "1.1",
    "current_price_fallback": 0.31,
    "current_price_as_of": "2026-07-31 market close",
    "benchmark": "Nasdaq Composite",
    "diluted_shares": 166387199,
    "market": "US"
  },
  "summary": {
    "status": "CATALYST_RICH",
    "one_line": "Q2開示、9月2日株主総会、S-1効力発生、12月7日Nasdaq期限が連続し、業績より資本構成と上場維持が短期株価を左右しやすい。",
    "next_catalyst_id": "capital-vote-20260902",
    "next_window": "次の確定日：2026-09-02。Q2 2026決算はそれ以前の可能性があるが会社発表日未確認。",
    "primary_risk": "最大150.622M株の再販登録と、会社開示166.387M株の完全希薄化後株式数による需給・1株価値の低下。",
    "surprise_up": "Q2でARR成長と低い資金消費を示し、Nasdaq適合へ株式併合以外の経路が見えること。",
    "surprise_down": "S-1効力発生後の大量売却、Q2現金消費の悪化、または株主総会後の追加株式供給。",
    "overall_priced_in": {
      "quantifiable": false,
      "percent_range": null,
      "raw_implied_pct": null,
      "label": "MEDIUM_TO_HIGH",
      "confidence": "LOW",
      "event_excluded_equity_value": null,
      "full_success_incremental_equity_value": null,
      "market_implied_success_probability": null,
      "independent_success_probability": null,
      "evidence_for": [
        "2026-07-01の$0.404から2026-07-31の$0.31まで約23%下落した。",
        "現値は優先株転換・交換価格$0.435と普通ワラント行使価格$0.45〜$0.50を下回る。",
        "Nasdaq最低買付価格$1を大幅に下回る。"
      ],
      "evidence_against": [
        "S-1は提出されたばかりで効力発生日と実際の売却量が未確認。",
        "株主総会の投票結果、Q2現金残高、追加契約が未開示。",
        "低流動性銘柄のため、短期価格変動を単一材料へ帰属できない。"
      ],
      "caveats": [
        "事業価値を除いたイベント単独価値と成功時増分価値を分離できない。",
        "オプション市場または信頼できる複数アナリスト予想を確認できない。"
      ],
      "unquantifiable_reason": "登録株式の実売却量、株主総会結果、Q2財務、ワラント行使行動が未確定で、イベント除外時企業価値を独立に推定できない。",
      "qualitative_assessment": "大きな希薄化・上場維持リスクは相応に認識されている可能性があるが、実際の株式供給が始まる局面の下方リスクは残る。",
      "revaluation_trigger": "Q2 10-Q、S-1のEFFECT提出、9月2日投票結果、売却株主の保有変化が開示された時点。"
    }
  },
  "catalysts": [
    {
      "id": "capital-vote-20260902",
      "title": "特別株主総会：PIPE関連発行、優先株転換／交換、株式報酬枠の承認",
      "event_type": "QUANTITATIVE",
      "category": "FINANCING",
      "status": "SCHEDULED",
      "importance": 5,
      "direction": "TWO_SIDED",
      "date": {
        "display_text": "2026年9月2日 10:00 ET（暫定委任状記載）",
        "start_date": "2026-09-02",
        "end_date": "2026-09-02",
        "precision": "EXACT",
        "basis": "CONFIRMED",
        "confidence": "HIGH",
        "timezone": "America/New_York",
        "source_ids": [
          "src-pre14a-20260731"
        ]
      },
      "plain_language": "株主が、7月資金調達に伴う大量の株式発行と、株式報酬枠20M株の追加を認めるか決める。",
      "why_it_matters": "承認は資本構成の確定に必要だが、60.154M株相当の優先株転換・交換、76.649M株相当の普通ワラント、20M株の報酬枠増額に関係し、既存1株価値へ大きく影響する。",
      "detail": "PRE 14Aは2026-09-02のバーチャル特別総会と2026-08-07の基準日を記載。Nasdaq Proposal、Plan Amendment Proposal、Adjournment Proposalを付議し、取締役会は各議案に賛成を推奨。7月30日には定足数を33 1/3%へ引き下げる定款細則変更を採択した。",
      "mechanism": [
        "承認 → 優先株転換・Series C交換が契約どおり実行可能 → 普通株供給増",
        "承認 → Series A/B普通ワラントが行使可能 → 株価が行使価格を上回れば資金流入と追加希薄化",
        "報酬枠承認 → 2026年枠が2.072M株から22.072M株へ増加 → 将来SBC余地拡大"
      ],
      "quantification_priority": 1,
      "outcomes": [
        {
          "label": "APPROVED",
          "conditions": [
            "Nasdaq Proposalが承認される",
            "優先株転換・交換取引が契約どおり進む",
            "Plan Amendment Proposalの可否を個別確認する"
          ],
          "quantifiable": false,
          "quantification_basis": "CONFIRMED",
          "price_change_pct_range": null,
          "price_range": null,
          "direction": "MIXED",
          "effect_on_assumptions": [
            "Base評価株式数88.563M株の実現可能性が高まる",
            "Bull完全希薄化166.387M株と最大$36.410M現金流入の経路が開く"
          ],
          "probability": null,
          "unquantifiable_reason": "承認自体は数量化できるが、転換・交換・ワラント行使後の実売却量と市場需給が未確定。",
          "qualitative_assessment": "資本構成の不確実性低下はプラスだが、普通株供給増はマイナスで、短期株価方向は二面性がある。",
          "revaluation_trigger": "議決結果、取引完了8-K、転換・交換後の発行済み株式数、ワラント行使開示。"
        },
        {
          "label": "NOT_APPROVED_OR_ADJOURNED",
          "conditions": [
            "Nasdaq Proposalが否決される、または定足数・票不足で延期される",
            "優先株転換・交換が予定どおり完了しない"
          ],
          "quantifiable": false,
          "quantification_basis": "CONFIRMED",
          "price_change_pct_range": null,
          "price_range": null,
          "direction": "MIXED",
          "effect_on_assumptions": [
            "短期の普通株供給は抑制される",
            "優先株オーバーハングと資金調達契約の不確実性が残る"
          ],
          "probability": null,
          "unquantifiable_reason": "否決後の契約修正、再投票、優先株条件、追加調達の対応が不明。",
          "qualitative_assessment": "短期希薄化の抑制と、資本構成不確実性・流動性悪化が相殺し得る。",
          "revaluation_trigger": "会社の代替取引条件、再招集日、投資家との契約修正開示。"
        }
      ],
      "impact_method": "一次提出書類の発行可能株式数と現行株式数を比較し、価格反応は定量不能として方向性のみ評価。",
      "impact_horizon": "総会当日から12か月",
      "impact_confidence": "MEDIUM",
      "price_impact_direction": "MIXED",
      "price_impact_magnitude": "LARGE",
      "price_impact_unquantifiable_reason": "承認後の売却量、株価がワラント行使価格を超える期間、PIPE投資家の保有意図が不明。",
      "price_impact_revaluation_trigger": "投票結果、発行済み株式数、ワラント行使、登録株式売却量の開示。",
      "priced_in": {
        "quantifiable": false,
        "percent_range": null,
        "raw_implied_pct": null,
        "label": "MEDIUM_TO_HIGH",
        "confidence": "LOW",
        "event_excluded_equity_value": null,
        "full_success_incremental_equity_value": null,
        "market_implied_success_probability": null,
        "independent_success_probability": null,
        "evidence_for": [
          "PIPE価格・転換価格・ワラント条件はすでにSEC提出書類で公開済み。",
          "株価は転換価格$0.435とワラント行使価格を下回る。"
        ],
        "evidence_against": [
          "PRE 14Aは7月31日提出で、市場が総会議案を消化した期間が短い。",
          "議案別の投票確度を示す検証可能なデータがない。"
        ],
        "caveats": [
          "低流動性のため価格だけから成功確率を逆算できない。"
        ],
        "unquantifiable_reason": "事業価値と資本構成イベント価値を分離できず、投票確率の市場指標もない。",
        "qualitative_assessment": "数量条件は知られているため相応に織り込まれ得るが、承認後の実際の売却圧力は未織り込みの可能性がある。",
        "revaluation_trigger": "最終委任状、委任状勧誘状況、議決結果、出来高・保有報告。"
      },
      "leading_indicators": [
        "最終DEF 14Aの提出",
        "委任状補足資料と投票勧誘",
        "2026-08-07基準日時点の議決権構成",
        "出来高と大株主・役員の保有変化"
      ],
      "dependencies": [
        "resale-registration-effectiveness"
      ],
      "dependency_group": "capital-structure-2026",
      "sell_the_news_risk": "承認は会社が推奨し契約履行に必要なため、承認自体が予想どおりでも、その後の株式供給が材料出尽くし売りを誘う可能性がある。",
      "financing_risk": "承認後のワラント行使は資金流入源だが、株価が$0.45〜$0.50を下回る間は現金行使が期待しにくく、追加調達が必要になる可能性がある。",
      "dilution_impact": "現発行済み15.765M株に対し、会社開示の完全希薄化後166.387M株は約10.6倍。別途、報酬枠20M株増額議案がある。",
      "update_triggers": [
        "DEF 14Aまたは委任状補足資料の提出",
        "2026-09-02の議決結果8-K",
        "優先株転換・Series C交換の完了",
        "普通ワラント行使または条件変更"
      ],
      "source_ids": [
        "src-pre14a-20260731",
        "src-s1-20260730",
        "src-8k-financing-20260710",
        "src-8k-bylaws-20260731"
      ],
      "extra_items": [
        {
          "label": "総会基準日",
          "value": "2026-08-07",
          "source_ids": [
            "src-pre14a-20260731"
          ]
        },
        {
          "label": "株式報酬枠",
          "value": "2,072,125株から22,072,125株へ20,000,000株増額する議案",
          "source_ids": [
            "src-pre14a-20260731"
          ]
        }
      ]
    },
    {
      "id": "q2-2026-results",
      "title": "Q2 2026決算・Form 10-Q",
      "event_type": "QUANTITATIVE",
      "category": "EARNINGS",
      "status": "TBD",
      "importance": 4,
      "direction": "TWO_SIDED",
      "date": {
        "display_text": "会社発表日未確認",
        "start_date": null,
        "end_date": null,
        "precision": "TBD",
        "basis": "UNKNOWN",
        "confidence": "LOW",
        "timezone": null,
        "source_ids": [
          "src-10q-2026q1"
        ]
      },
      "plain_language": "売上・ARR・契約残高が伸び、7月資金調達後の現金で事業をどれだけ継続できるか確認する。",
      "why_it_matters": "Q1のARR$7.0MがGAAP売上へ転換しているか、Q1営業CF-$2.598Mの資金消費が改善したかが、次回調達とBaseシナリオを左右する。",
      "detail": "Q1 2026は売上$1.415M（前年比+12%）、粗利$1.223M、営業損失$11.824M、現金$3.122M、ARR$7.0M、RPO$4.794M。7月PIPE総額約$6M後の流動性をQ2開示で更新する必要がある。",
      "mechanism": [
        "売上・ARR成長 → 将来売上期待とEV/売上高倍率",
        "営業CF改善 → 次回資金調達までの期間延長 → 希薄化リスク低下",
        "現金減少加速 → 追加調達確率上昇 → 1株価値低下"
      ],
      "quantification_priority": 6,
      "outcomes": [
        {
          "label": "OUTPERFORM",
          "conditions": [
            "売上成長率がQ1の12%を明確に上回る",
            "ARRが$7.0Mから増加し、RPOの売上転換が進む",
            "四半期営業CF赤字がQ1の$2.598Mから縮小する"
          ],
          "quantifiable": false,
          "quantification_basis": "MODEL_ESTIMATE",
          "price_change_pct_range": null,
          "price_range": null,
          "direction": "UP",
          "effect_on_assumptions": [
            "2027年Base/Bull売上高の上方修正",
            "Base純現金の上方修正"
          ],
          "probability": null,
          "unquantifiable_reason": "会社ガイダンスと信頼できる複数社コンセンサスがない。",
          "qualitative_assessment": "成長と資金効率の同時改善なら強いポジティブ。",
          "revaluation_trigger": "実績売上、ARR、RPO、営業CF、現金残高の開示。"
        },
        {
          "label": "INLINE",
          "conditions": [
            "売上・ARRがQ1に近いペースで成長する",
            "粗利率80%台を維持する",
            "営業CF赤字が大きく悪化しない"
          ],
          "quantifiable": false,
          "quantification_basis": "MODEL_ESTIMATE",
          "price_change_pct_range": null,
          "price_range": null,
          "direction": "FLAT",
          "effect_on_assumptions": [
            "Baseシナリオを維持"
          ],
          "probability": null,
          "unquantifiable_reason": "市場コンセンサスがなく、期待値の基準を厳密に定義できない。",
          "qualitative_assessment": "資本構成イベントが株価の主因であり、業績のみでは方向が限定的。",
          "revaluation_trigger": "会社の通期見通しまたは契約KPI開示。"
        },
        {
          "label": "UNDERPERFORM",
          "conditions": [
            "売上が横ばいまたは減少する",
            "ARRが$7.0Mを下回る、またはRPOが縮小する",